{
  "schemaVersion": "1.0",
  "runnerId": "runner-local-01",
  "identity": {
    "workloadId": "git:owner@example.com"
  },
  "kind": "remote",
  "os": "linux",
  "runtime": {
    "name": "dotnet",
    "version": "10.0.4"
  },
  "providers": [
    "k8s"
  ],
  "tags": [
    "os:linux",
    "gpu:none"
  ],
  "gpu": false,
  "version": "0.44.0",
  "networkZone": "us-1"
}
